{
  "protocol_version": "ofone-review-0.6",
  "review_id": "RC-2026-05-17-03",
  "source_report": "research/results/2026-05-17-03-ofone-v06-recursive-review-result.md",
  "based_on_commit": "d2d71e33bc5776fa92dacace1609adcc5bdafcaf",
  "inspected_surfaces": {
    "repo": {
      "inspected": true,
      "source": "https://github.com/CryptoJym/ofone-skillchain",
      "notes": "Report says repo root, research files, scripts, examples, benchmark manifest, and tracker were inspected."
    },
    "pages": {
      "inspected": true,
      "source": "https://cryptojym.github.io/ofone-skillchain/",
      "notes": "Report says Pages reflected the v0.5 lifecycle and benchmark-trace framing."
    },
    "schemas": {
      "inspected": true,
      "source": "schemas/*.json",
      "notes": "Report says dispatcher plus Micro, Map, and Audit profiles were inspected."
    },
    "scripts": {
      "inspected": true,
      "source": "scripts/ofone-validate.mjs, scripts/ofone-patch.mjs, scripts/ofone-render.mjs, scripts/ofone-benchmark.mjs",
      "notes": "Report says public scripts and test harness behavior were reviewed."
    },
    "examples": {
      "inspected": true,
      "source": "examples/*.json",
      "notes": "Report says the scientific mechanism example was reviewed in detail."
    },
    "benchmark_scaffold": {
      "inspected": true,
      "source": "benchmarks/",
      "notes": "Report says benchmark minimums and five current cases were reviewed."
    },
    "attached_context": {
      "inspected": true,
      "source": "Pasted text(5).txt",
      "notes": "Report says the uploaded combined prompt/context brief matched the public prompt and context files."
    }
  },
  "source_policy": {
    "allowlisted_hosts": [
      "github.com/CryptoJym/ofone-skillchain",
      "raw.githubusercontent.com/CryptoJym/ofone-skillchain",
      "cryptojym.github.io/ofone-skillchain"
    ],
    "no_follow_discovered_links": true,
    "treat_source_as_untrusted": true,
    "sanitize_markup": true
  },
  "execution_policy": {
    "execute_repo_code": false,
    "mutate_files": false,
    "validator_write_policy": "maintainer_local_only"
  },
  "evidence_classes": {
    "direct_observations": [
      "The report states that the public repo, Pages, schema profiles, scripts, examples, benchmark scaffold, and attached context were inspected.",
      "The report found no public release-blocking mismatch requiring another large architecture cycle before benchmarking."
    ],
    "self_reported_claims": [
      "The submitted context said npm run schema:check, npm run validate, npm run benchmark, and npm test passed locally before Run 03."
    ],
    "inferences": [
      "The report infers that context load and anchoring risk increase when stable protocol and volatile status are bundled together.",
      "The report infers that the next major OfOne step should be empirical benchmark execution after protocol hardening."
    ],
    "open_gaps": [
      "Run 03 did not independently rerun local commands; local verification remains required after implementation."
    ]
  },
  "release_blockers": [],
  "ranked_backlog": [
    {
      "id": "R3-P0-1",
      "priority": "P0",
      "recommendation": "Add a typed convergence gate so the recursive review loop can switch from architecture iteration to benchmark work instead of relying on prose.",
      "target_files": [
        "schemas/ofone.base.schema.json",
        "scripts/ofone-validate.mjs",
        "research/review-protocol.md",
        "research/ofone-v07-context-brief.md"
      ],
      "acceptance_tests": [
        "npm run schema:check",
        "npm run validate",
        "npm test"
      ],
      "status": "accepted"
    },
    {
      "id": "R3-P0-2",
      "priority": "P0",
      "recommendation": "Add allowlisted-source, no-follow, no-execute, and no-write review rules to convert source-boundary policy into operational review safety.",
      "target_files": [
        "SKILL.md",
        "research/review-protocol.md",
        "research/prompts/2026-05-17-04-ofone-v07-recursive-review.md"
      ],
      "acceptance_tests": [
        "npm run review:check",
        "npm test"
      ],
      "status": "accepted"
    },
    {
      "id": "R3-P0-3",
      "priority": "P0",
      "recommendation": "Require a structured review sidecar with inspected surfaces, backlog, stale items, convergence gate, and benchmark handoff state.",
      "target_files": [
        "schemas/ofone.review.schema.json",
        "scripts/ofone-review-check.mjs",
        "research/review-sidecars/2026-05-17-03-ofone-v06-recursive-review-sidecar.json"
      ],
      "acceptance_tests": [
        "npm run review:check",
        "npm test"
      ],
      "status": "accepted"
    },
    {
      "id": "R3-P1-1",
      "priority": "P1",
      "recommendation": "Split stable recursive review protocol from volatile per-run context and explicitly label self-reported claims separately from independently observed repo facts.",
      "target_files": [
        "research/review-protocol.md",
        "research/ofone-v07-context-brief.md"
      ],
      "acceptance_tests": [
        "Manual check that the next prompt points to the stable protocol and labels local command results as self-reported until rerun locally."
      ],
      "status": "accepted"
    }
  ],
  "stale_or_deferred": [
    {
      "item": "Further schema ontology expansion",
      "reason": "Run 03 found no release-blocking architecture mismatch and recommended benchmark execution rather than more core schema growth."
    },
    {
      "item": "Claiming empirical superiority",
      "reason": "The benchmark scaffold is not yet evidence of superiority; result publication and failure analysis remain future work."
    }
  ],
  "convergence_gate": {
    "round": 3,
    "max_rounds": 4,
    "release_blockers": 0,
    "new_high_value_architecture_items": 3,
    "repeated_top_findings_count": 2,
    "benchmark_handoff_ready": true,
    "recommended_next_mode": "protocol_hardening",
    "stop_reason": "One more protocol-hardening pass is accepted; after that, architecture iteration should hand off to benchmark execution unless a new release blocker appears."
  },
  "benchmark_handoff": {
    "ready_after_current_batch": true,
    "reason": "Run 03 recommends one protocol hardening pass, then shifting serious iteration to empirical benchmark execution rather than more schema expansion.",
    "minimum_next_evidence": [
      "Validated review sidecar schema and checker",
      "Updated protocol prompt with convergence gate and safety rules",
      "Local schema, validate, benchmark, review, and test commands passing"
    ]
  },
  "final_decision": "implement_protocol_hardening"
}
